{"execution_digest":"b76c7e1d08e0ff488a211a757ddb826c25761a9825f5a72123b8849249a3d7b6","intervals":[{"h_bounds":[-5.0,-0.05],"half_space_role":"positive_half","interval_id":1,"k_bounds":[-5.0,-0.05],"l_bounds":[0.05,5.0],"l_coverage":"positive-L","mask_digest":"ceb4553d0df346335be90f719fa4492c725a01158fcd8ac0d3f3a80e2f8cc42b","q_grid_digest":"d491e6f7502a96fa1dcb037a4bbc8c338d8055a8e5a27a5ef72f6eb1b1da061b","reciprocal_multiplicity":2,"reciprocal_point_count":2000000},{"h_bounds":[-5.0,-0.05],"half_space_role":"positive_half","interval_id":2,"k_bounds":[-10.0,-5.05],"l_bounds":[0.05,5.0],"l_coverage":"positive-L","mask_digest":"ceb4553d0df346335be90f719fa4492c725a01158fcd8ac0d3f3a80e2f8cc42b","q_grid_digest":"1bc670e7e130eb10265773aedface7550c2a42414764a9343e48db08f829f2cd","reciprocal_multiplicity":2,"reciprocal_point_count":2000000},{"h_bounds":[-5.0,-0.05],"half_space_role":"positive_half","interval_id":3,"k_bounds":[-15.0,-10.05],"l_bounds":[0.05,5.0],"l_coverage":"positive-L","mask_digest":"ceb4553d0df346335be90f719fa4492c725a01158fcd8ac0d3f3a80e2f8cc42b","q_grid_digest":"920c80264544ddec4426ea3311c1f3ccf245b41f95e0fda46ed471feebe9ca30","reciprocal_multiplicity":2,"reciprocal_point_count":2000000},{"h_bounds":[-5.0,-0.05],"half_space_role":"positive_half","interval_id":4,"k_bounds":[-20.0,-15.05],"l_bounds":[0.05,5.0],"l_coverage":"positive-L","mask_digest":"ceb4553d0df346335be90f719fa4492c725a01158fcd8ac0d3f3a80e2f8cc42b","q_grid_digest":"65a2c37cf91513c46f66f8e4e89262c875f3fd0d0523a4e3e172c74070dd43bb","reciprocal_multiplicity":2,"reciprocal_point_count":2000000},{"h_bounds":[-5.0,-0.05],"half_space_role":"positive_half","interval_id":5,"k_bounds":[0.0,5.0],"l_bounds":[0.05,5.0],"l_coverage":"positive-L","mask_digest":"ceb4553d0df346335be90f719fa4492c725a01158fcd8ac0d3f3a80e2f8cc42b","q_grid_digest":"a6048c34459bf73c2fbb3429197f13c73dc4f96ecbdc941a66638fcd62426b49","reciprocal_multiplicity":2,"reciprocal_point_count":2020000},{"h_bounds":[-5.0,-0.05],"half_space_role":"positive_half","interval_id":6,"k_bounds":[5.05,10.0],"l_bounds":[0.05,5.0],"l_coverage":"positive-L","mask_digest":"ceb4553d0df346335be90f719fa4492c725a01158fcd8ac0d3f3a80e2f8cc42b","q_grid_digest":"2f218ba33be751f7fed083165dfbcb24f849855364fa268ff5e00e03ebd84f1a","reciprocal_multiplicity":2,"reciprocal_point_count":2000000},{"h_bounds":[-5.0,-0.05],"half_space_role":"positive_half","interval_id":7,"k_bounds":[10.05,15.0],"l_bounds":[0.05,5.0],"l_coverage":"positive-L","mask_digest":"ceb4553d0df346335be90f719fa4492c725a01158fcd8ac0d3f3a80e2f8cc42b","q_grid_digest":"fe4810c16c8eaff18797b6cd16dcd659b3ad42efaa21a3a09184d6db6d19316f","reciprocal_multiplicity":2,"reciprocal_point_count":2000000},{"h_bounds":[-5.0,-0.05],"half_space_role":"positive_half","interval_id":8,"k_bounds":[15.05,20.0],"l_bounds":[0.05,5.0],"l_coverage":"positive-L","mask_digest":"ceb4553d0df346335be90f719fa4492c725a01158fcd8ac0d3f3a80e2f8cc42b","q_grid_digest":"65cb73062585f01dff4663f8108449aee3af85759016f2cc6728d21404e595f9","reciprocal_multiplicity":2,"reciprocal_point_count":2000000},{"h_bounds":[-10.0,-5.05],"half_space_role":"positive_half","interval_id":9,"k_bounds":[-5.0,-0.05],"l_bounds":[0.05,5.0],"l_coverage":"positive-L","mask_digest":"ceb4553d0df346335be90f719fa4492c725a01158fcd8ac0d3f3a80e2f8cc42b","q_grid_digest":"6519cebe18b2c14370cd3ebdbf1fb624513bb5c6906012282447e09d63598480","reciprocal_multiplicity":2,"reciprocal_point_count":2000000},{"h_bounds":[-10.0,-5.05],"half_space_role":"positive_half","interval_id":10,"k_bounds":[-10.0,-5.05],"l_bounds":[0.05,5.0],"l_coverage":"positive-L","mask_digest":"ceb4553d0df346335be90f719fa4492c725a01158fcd8ac0d3f3a80e2f8cc42b","q_grid_digest":"a6647708345c738b8fa1756d7dcad3b0c891d9f950adcf0c721dff90368e368d","reciprocal_multiplicity":2,"reciprocal_point_count":2000000},{"h_bounds":[-10.0,-5.05],"half_space_role":"positive_half","interval_id":11,"k_bounds":[-15.0,-10.05],"l_bounds":[0.05,5.0],"l_coverage":"positive-L","mask_digest":"ceb4553d0df346335be90f719fa4492c725a01158fcd8ac0d3f3a80e2f8cc42b","q_grid_digest":"e3e534030ff93448ac5b4910ed49135f8083750a50e09eb871ba9ae2200bae51","reciprocal_multiplicity":2,"reciprocal_point_count":2000000},{"h_bounds":[-10.0,-5.05],"half_space_role":"positive_half","interval_id":12,"k_bounds":[-20.0,-15.05],"l_bounds":[0.05,5.0],"l_coverage":"positive-L","mask_digest":"ceb4553d0df346335be90f719fa4492c725a01158fcd8ac0d3f3a80e2f8cc42b","q_grid_digest":"91208085f86ba3cfa7abd10f10300b3d770fb1866a79f9a8b15a752f70cfec64","reciprocal_multiplicity":2,"reciprocal_point_count":2000000},{"h_bounds":[-10.0,-5.05],"half_space_role":"positive_half","interval_id":13,"k_bounds":[0.0,5.0],"l_bounds":[0.05,5.0],"l_coverage":"positive-L","mask_digest":"ceb4553d0df346335be90f719fa4492c725a01158fcd8ac0d3f3a80e2f8cc42b","q_grid_digest":"d6e2c862de3808a5a8da177d0c563354f0760f442739e3db6a9e571e037ba7a1","reciprocal_multiplicity":2,"reciprocal_point_count":2020000},{"h_bounds":[-10.0,-5.05],"half_space_role":"positive_half","interval_id":14,"k_bounds":[5.05,10.0],"l_bounds":[0.05,5.0],"l_coverage":"positive-L","mask_digest":"ceb4553d0df346335be90f719fa4492c725a01158fcd8ac0d3f3a80e2f8cc42b","q_grid_digest":"4586a4a9fb4b76649b4d58681382316d8b300dc33652ba38912973298b6d7074","reciprocal_multiplicity":2,"reciprocal_point_count":2000000},{"h_bounds":[-10.0,-5.05],"half_space_role":"positive_half","interval_id":15,"k_bounds":[10.05,15.0],"l_bounds":[0.05,5.0],"l_coverage":"positive-L","mask_digest":"ceb4553d0df346335be90f719fa4492c725a01158fcd8ac0d3f3a80e2f8cc42b","q_grid_digest":"2e6a2899c74da4bf691d9723159c0586d0243788fb41111e8245e9e11ba44ab3","reciprocal_multiplicity":2,"reciprocal_point_count":2000000},{"h_bounds":[-10.0,-5.05],"half_space_role":"positive_half","interval_id":16,"k_bounds":[15.05,20.0],"l_bounds":[0.05,5.0],"l_coverage":"positive-L","mask_digest":"ceb4553d0df346335be90f719fa4492c725a01158fcd8ac0d3f3a80e2f8cc42b","q_grid_digest":"7de5f9b340a9023a74835f35f1aaeecf470c8811a711a3d1bbb2c541c5673649","reciprocal_multiplicity":2,"reciprocal_point_count":2000000},{"h_bounds":[-15.0,-10.05],"half_space_role":"positive_half","interval_id":17,"k_bounds":[-5.0,-0.05],"l_bounds":[0.05,5.0],"l_coverage":"positive-L","mask_digest":"ceb4553d0df346335be90f719fa4492c725a01158fcd8ac0d3f3a80e2f8cc42b","q_grid_digest":"6da5e5b22bc58690da98af1db70e021e7b8830b26f6620d97fc39768ed17e03a","reciprocal_multiplicity":2,"reciprocal_point_count":2000000},{"h_bounds":[-15.0,-10.05],"half_space_role":"positive_half","interval_id":18,"k_bounds":[-10.0,-5.05],"l_bounds":[0.05,5.0],"l_coverage":"positive-L","mask_digest":"ceb4553d0df346335be90f719fa4492c725a01158fcd8ac0d3f3a80e2f8cc42b","q_grid_digest":"9571aa30af030b74ded1a37f323ca9f4f34071d6129d8313bf4062e5025892b4","reciprocal_multiplicity":2,"reciprocal_point_count":2000000},{"h_bounds":[-15.0,-10.05],"half_space_role":"positive_half","interval_id":19,"k_bounds":[-15.0,-10.05],"l_bounds":[0.05,5.0],"l_coverage":"positive-L","mask_digest":"ceb4553d0df346335be90f719fa4492c725a01158fcd8ac0d3f3a80e2f8cc42b","q_grid_digest":"8f1cc8474474bc7a5f812bf691cfa5a757e8c9eefea4688d3a87e4d877fbe525","reciprocal_multiplicity":2,"reciprocal_point_count":2000000},{"h_bounds":[-15.0,-10.05],"half_space_role":"positive_half","interval_id":20,"k_bounds":[-20.0,-15.05],"l_bounds":[0.05,5.0],"l_coverage":"positive-L","mask_digest":"ceb4553d0df346335be90f719fa4492c725a01158fcd8ac0d3f3a80e2f8cc42b","q_grid_digest":"88bfc6d4701f1be404a992c092d0e175007d381ee8eaafcba583456c4e2b6810","reciprocal_multiplicity":2,"reciprocal_point_count":2000000},{"h_bounds":[-15.0,-10.05],"half_space_role":"positive_half","interval_id":21,"k_bounds":[0.0,5.0],"l_bounds":[0.05,5.0],"l_coverage":"positive-L","mask_digest":"ceb4553d0df346335be90f719fa4492c725a01158fcd8ac0d3f3a80e2f8cc42b","q_grid_digest":"76608b8a4c4622cc85eef1ca705ff13018e711e745cfd3d09233e95ea6e4c683","reciprocal_multiplicity":2,"reciprocal_point_count":2020000},{"h_bounds":[-15.0,-10.05],"half_space_role":"positive_half","interval_id":22,"k_bounds":[5.05,10.0],"l_bounds":[0.05,5.0],"l_coverage":"positive-L","mask_digest":"ceb4553d0df346335be90f719fa4492c725a01158fcd8ac0d3f3a80e2f8cc42b","q_grid_digest":"b74e2cc07b2688cbeb941aefe1c575786866ea8edd56dc0fc776626e4379b9d6","reciprocal_multiplicity":2,"reciprocal_point_count":2000000},{"h_bounds":[-15.0,-10.05],"half_space_role":"positive_half","interval_id":23,"k_bounds":[10.05,15.0],"l_bounds":[0.05,5.0],"l_coverage":"positive-L","mask_digest":"ceb4553d0df346335be90f719fa4492c725a01158fcd8ac0d3f3a80e2f8cc42b","q_grid_digest":"4c90a3fb30fd752c566c754c329fb2c9bc37206b2ae8c7a69de5a8e185cac6f2","reciprocal_multiplicity":2,"reciprocal_point_count":2000000},{"h_bounds":[-15.0,-10.05],"half_space_role":"positive_half","interval_id":24,"k_bounds":[15.05,20.0],"l_bounds":[0.05,5.0],"l_coverage":"positive-L","mask_digest":"ceb4553d0df346335be90f719fa4492c725a01158fcd8ac0d3f3a80e2f8cc42b","q_grid_digest":"83411f4f509ea9981acfeaa1a0d3ef71e7eac96b25c983f46067939dc40f1259","reciprocal_multiplicity":2,"reciprocal_point_count":2000000},{"h_bounds":[-20.0,-15.05],"half_space_role":"positive_half","interval_id":25,"k_bounds":[-5.0,-0.05],"l_bounds":[0.05,5.0],"l_coverage":"positive-L","mask_digest":"ceb4553d0df346335be90f719fa4492c725a01158fcd8ac0d3f3a80e2f8cc42b","q_grid_digest":"2d702b6112a98b2b9dc6ae33d9695e331b86b13044a53abf74d4311e4e30a22a","reciprocal_multiplicity":2,"reciprocal_point_count":2000000},{"h_bounds":[-20.0,-15.05],"half_space_role":"positive_half","interval_id":26,"k_bounds":[-10.0,-5.05],"l_bounds":[0.05,5.0],"l_coverage":"positive-L","mask_digest":"ceb4553d0df346335be90f719fa4492c725a01158fcd8ac0d3f3a80e2f8cc42b","q_grid_digest":"8639f54b69c47a630e144cf50ba95e2c8d0d8a8a25a6a5285f49d7fe777c46c8","reciprocal_multiplicity":2,"reciprocal_point_count":2000000},{"h_bounds":[-20.0,-15.05],"half_space_role":"positive_half","interval_id":27,"k_bounds":[-15.0,-10.05],"l_bounds":[0.05,5.0],"l_coverage":"positive-L","